{"$id":"yggdrasil/contracts/v1/campaign_file","$schema":"https://json-schema.org/draft/2020-12/schema","additionalProperties":false,"properties":{"campaign":{"pattern":"^[a-z0-9][a-z0-9-]*-v[0-9]+$","type":"string"},"note":{"minLength":3,"type":"string"},"parts":{"items":{"$ref":"campaign_part.schema.json"},"maxItems":11,"minItems":11,"type":"array"},"roadmap_slice":{"pattern":"^Y-[0-9]{3}$","type":"string"},"slices":{"items":{"$ref":"campaign_slice.schema.json"},"maxItems":244,"minItems":244,"type":"array"},"source_roadmap":{"minLength":3,"type":"string"},"title":{"minLength":3,"type":"string"},"total_parts":{"const":11,"type":"integer"},"total_slices":{"const":244,"type":"integer"}},"required":["campaign","roadmap_slice","title","source_roadmap","total_parts","total_slices","parts","slices"],"title":"CampaignFile v1 — the whole build roadmap as machine data: 11 parts, 244 slices, generated from the roadmap markdown and drift-checked against it (Y-019)","type":"object"}