{"campaign": "yggdrasil-campaign-v1", "note": "The build roadmap as machine data (Y-019), GENERATED from docs/YGGDRASIL_BUILD_ROADMAP_2026-10-30.md by yggdrasil.campaign.build_campaign and drift-checked against it by verify_campaign: the markdown is the law, this file is its mirror. Slice text is the roadmap's own wording, reflowed where the markdown wraps a line. Banking state is NOT kept here — it lives in CAMPAIGN_STATE.md.", "parts": [{"first_slice": "Y-001", "goal": "turn a specification into a buildable project. Every open choice the spec leaves becomes a written decision; every component gets a contract before it gets code.", "last_slice": "Y-020", "name": "Roots: decisions, contracts, scaffolding", "number": 1, "roman": "I", "slice_count": 20}, {"first_slice": "Y-021", "goal": "one agent that runs on the Pi, the laptop, and anything between — censusing what it truly has, hosting models through the engines that exist, and minding its own resources like a good neighbour.", "last_slice": "Y-048", "name": "The Node Agent: every device a citizen", "number": 2, "roman": "II", "slice_count": 28}, {"first_slice": "Y-049", "goal": "the squirrel that never stops running — discovery, registry, heartbeats, and task/result flow between nodes, secure by default, honest under partition.", "last_slice": "Y-074", "name": "Ratatoskr: the message fabric", "number": 3, "roman": "III", "slice_count": 26}, {"first_slice": "Y-075", "goal": "the present-tense Norn. Given a task, choose where it runs — by capability, by load, by measured fitness — and own its whole lifecycle from the spec §4.1 state machine.", "last_slice": "Y-100", "name": "Verðandi: scheduler & semantic router", "number": 4, "roman": "IV", "slice_count": 26}, {"first_slice": "Y-101", "goal": "the past-tense Norn. The mesh remembers — decisions, contexts, outcomes — as a versioned knowledge graph any node can ask, so the whole tree is wiser than any branch.", "last_slice": "Y-122", "name": "Urðr: memory & the knowledge graph", "number": 5, "roman": "V", "slice_count": 22}, {"first_slice": "Y-123", "goal": "the future-tense Norn. Verify what the mesh produces, project what it is about to do, and price risk before it is paid — the spec's most original organ, built with the most honesty about its limits.", "last_slice": "Y-144", "name": "Skuld: verifier & temporal projection", "number": 6, "roman": "VI", "slice_count": 22}, {"first_slice": "Y-145", "goal": "the mesh's reason to exist — tasks no single small model on a single small device could serve, answered by the tree together: ensembles, role crews, learned routing, and overload grace.", "last_slice": "Y-166", "name": "Ensembles: many models, one answer", "number": 7, "roman": "VII", "slice_count": 22}, {"first_slice": "Y-167", "goal": "the mesh leaves the bench. Each world-role proven on the class of device it names — or honestly marked NOT PROVEN where the hardware isn't in the house.", "last_slice": "Y-188", "name": "The Nine Worlds on Real Hardware", "number": 8, "roman": "VIII", "slice_count": 22}, {"first_slice": "Y-189", "goal": "the tree serves the house that grew it. Each consumer binds by contract, and each binding is proven by that consumer doing real work through the mesh instead of around it.", "last_slice": "Y-208", "name": "The Workshop Weave", "number": 9, "roman": "IX", "slice_count": 20}, {"first_slice": "Y-209", "goal": "the addendum's planetary vision, worked as honest research. Most slices here end in findings, prototypes, or NOT PROVEN verdicts — that is their success shape, named in advance.", "last_slice": "Y-230", "name": "WorldNet Horizon", "number": 10, "roman": "X", "slice_count": 22}, {"first_slice": "Y-231", "goal": "close the way this house closes — with evidence. The tree's claims, all of them, cashed or corrected in one final accounting.", "last_slice": "Y-244", "name": "The Proof Spine", "number": 11, "roman": "XI", "slice_count": 14}], "roadmap_slice": "Y-019", "slices": [{"id": "Y-001", "number": 1, "part": 1, "text": "Spec reconciliation: the v3.1 README + WorldNet addendum read whole; a concordance maps every spec section to the part of this road that builds it (or names it deferred, with the reason).", "title": "Spec reconciliation"}, {"id": "Y-002", "number": 2, "part": 1, "text": "ADR-001 Language: Python control plane first (Decision 2), with the compiled-path criteria recorded (measured thresholds that would justify a Mojo/Rust component).", "title": "ADR-001 Language"}, {"id": "Y-003", "number": 3, "part": 1, "text": "ADR-002 Transport: the fabric benchmark design (MQTT vs NATS vs minimal gossip on Pi-class hardware, the mesh's real message shapes) — the benchmark itself runs in Part III; the *criteria* are fixed here.", "title": "ADR-002 Transport"}, {"id": "Y-004", "number": 4, "part": 1, "text": "ADR-003 State: CRDT scope per Decision 4 — which stores are CRDT-replicated, which are single-writer logs, and the merge rules.", "title": "ADR-003 State"}, {"id": "Y-005", "number": 5, "part": 1, "text": "ADR-004 Inference engines: the node wraps Aesir, Ollama, llama.cpp, and OpenAI-compatible local endpoints behind one contract; engine capability reporting is honest and per-engine.", "title": "ADR-004 Inference engines"}, {"id": "Y-006", "number": 6, "part": 1, "text": "The node contract v1: identity, capability census, model lifecycle, task execution, health — the interface every engine adapter and every Norn speaks; written before code.", "title": "The node contract v1"}, {"id": "Y-007", "number": 7, "part": 1, "text": "The task contract v1: task envelope (id, kind, payload, criticality, context refs, verification needs), result envelope, streaming shape, error taxonomy.", "title": "The task contract v1"}, {"id": "Y-008", "number": 8, "part": 1, "text": "The registry contract: model entries (name, sizes/quants, capabilities, device classes, measured speeds) — the spec §4.2 shape, as data schemas.", "title": "The registry contract"}, {"id": "Y-009", "number": 9, "part": 1, "text": "Repo scaffolding: package layout, pyproject, test harness, lint, the house no-Docker native-service pattern (systemd units as data), CI as manual-dispatch only (Volmarr's standing default).", "title": "Repo scaffolding"}, {"id": "Y-010", "number": 10, "part": 1, "text": "Threat model: node impersonation, poisoned results, gossip spam, malicious tasks — the mesh's enemies named before its doors are built.", "title": "Threat model"}, {"id": "Y-011", "number": 11, "part": 1, "text": "Identity foundation: per-node keypairs, node certificates issued by the mesh's own root (the WorldNet §3 seed, local scale), keys kept via Kista where a node supports it.", "title": "Identity foundation"}, {"id": "Y-012", "number": 12, "part": 1, "text": "The nine-worlds role model as data: role definitions (capabilities expected, criticality ceilings) assignable per node, changeable by the operator — roles are hats, not hardware.", "title": "The nine-worlds role model as data"}, {"id": "Y-013", "number": 13, "part": 1, "text": "Observability contract: what every component logs and meters (structured, local, no phone-home), the Verdandi event shapes reused where they fit.", "title": "Observability contract"}, {"id": "Y-014", "number": 14, "part": 1, "text": "The simulator: a loopback multi-node simulator (many fake nodes on one machine) — the road's wind tunnel; every later part tests in it before touching hardware.", "title": "The simulator"}, {"id": "Y-015", "number": 15, "part": 1, "text": "Fake engines: deterministic stub inference engines (echo, latency-shaped, failure-shaped) so routing can be proven without models.", "title": "Fake engines"}, {"id": "Y-016", "number": 16, "part": 1, "text": "Data discipline: all registries, profiles, and policies are versioned data files with schemas and validators.", "title": "Data discipline"}, {"id": "Y-017", "number": 17, "part": 1, "text": "The operator's door (Midgard v0): a CLI that can list nodes, tasks, and health from day one — humans are never locked out of their own tree.", "title": "The operator's door (Midgard v0)"}, {"id": "Y-018", "number": 18, "part": 1, "text": "Licence & provenance check: the repo's licence read and honoured; third-party pieces noticed; nothing vendored silently.", "title": "Licence & provenance check"}, {"id": "Y-019", "number": 19, "part": 1, "text": "The campaign file: this roadmap as machine data (the Mythic Coder M-201 pattern) so keepers and boards can run it.", "title": "The campaign file"}, {"id": "Y-020", "number": 20, "part": 1, "text": "Part I gate: contracts + ADRs + simulator skeleton merged; the concordance published in-repo; zero inference code yet — the roots hold before the trunk rises.", "title": "Part I gate"}, {"id": "Y-021", "number": 21, "part": 2, "text": "Node agent skeleton: identity (Y-011), config, lifecycle (start, join, drain, stop), native systemd service.", "title": "Node agent skeleton"}, {"id": "Y-022", "number": 22, "part": 2, "text": "Capability census: CPU, RAM, accelerators (CUDA, Hailo, NPU, none), disk, thermals — measured, not assumed; refreshed on change.", "title": "Capability census"}, {"id": "Y-023", "number": 23, "part": 2, "text": "Engine adapter I — Ollama: discovery, model list, generate (streaming), honest capability mapping into the node contract.", "title": "Engine adapter I — Ollama"}, {"id": "Y-024", "number": 24, "part": 2, "text": "Engine adapter II — Aesir: Aesir's API as it stands; its capability ledger (what is PROVEN on that device) feeds the census — the mesh never promises what Aesir itself marks partial.", "title": "Engine adapter II — Aesir"}, {"id": "Y-025", "number": 25, "part": 2, "text": "Engine adapter III — llama.cpp server + generic OpenAI-compatible local endpoints.", "title": "Engine adapter III"}, {"id": "Y-026", "number": 26, "part": 2, "text": "Model store: on-node model files with hashes; a model is \"present\" only when its hash verifies (the Aesir wave discipl